{
  "bundle_id": "bundle://cal0/i7@0.7.0",
  "package_version": "0.7.0",
  "stage": "CAL0-I7",
  "stage_status": "COMPLETE",
  "parameter_status": "AUTHORING_VALIDATED_PROVISIONAL",
  "closure_status": "VALIDATED_BASELINE_WITH_BOUNDED_RESIDUALS",
  "canonical_specification": "0.89",
  "calibration_annex": "2.9",
  "numerical_environment": {
    "language": "Python",
    "minimum_version": "3.11",
    "decimal_policy": "exact decimal strings until explicitly parsed",
    "float_policy": "forbidden in canonical records",
    "canonical_json": "UTF-8, sorted keys, compact separators, no NaN/Infinity"
  },
  "fixture_contract": {
    "suite_id": "fixture-suite://cal0/i2-reference@1",
    "case_count": 66,
    "seed_set": [
      17,
      83
    ],
    "traversal_set": [
      "forward",
      "reverse"
    ],
    "synthetic_only": true
  },
  "reference_contract": {
    "parameter_set_id": "parameter-set://cal0/i3-reference@1",
    "parameter_set_status": "PROVISIONAL",
    "scenario_suite_id": "scenario-suite://cal0/i3-reference@1",
    "character_count": 4,
    "scenario_count": 5,
    "canonicality": "REFERENCE_ONLY_NOT_STORY_CANON",
    "cohort_claims_permitted": false
  },
  "cohort_contract": {
    "plan_id": "cohort-plan://cal0/i4-human-reference@1",
    "suite_id": "cohort-suite://cal0/i4-reference@1",
    "successor_parameter_set_id": "parameter-set://cal0/i4-reference@1",
    "births_per_seed": 10000,
    "seed_count": 5,
    "iteration_count": 3,
    "comparison_ensemble_count": 6,
    "report_digest": "sha256:fb5057acf2c534a8178a3d39125f47006243d2bc711b89326249086219b64178",
    "canonicality": "INTERNAL_WORLD_CALIBRATION_NOT_EMPIRICAL_FACT"
  },
  "adversarial_contract": {
    "suite_id": "adversarial-suite://cal0/i5-reference@1",
    "attack_count": 42,
    "execution_count": 168,
    "surface_count": 9,
    "repair_count": 5,
    "unresolved_invariant_violation_count": 0,
    "report_digest": "sha256:a5436b77af57d5a3e155ff7ccb5e8b55f7741a8a69b5596c352eb088fae677ba",
    "canonicality": "INTERNAL_SYSTEM_VALIDATION_NOT_EMPIRICAL_FACT_OR_STORY_CANON"
  },
  "authoring_contract": {
    "suite_id": "authoring-suite://cal0/i6-reference@1",
    "sheet_count": 14,
    "projection_count": 84,
    "scenario_count": 15,
    "authoring_template_count": 10,
    "notification_template_count": 4,
    "change_entry_count": 6,
    "active_residual_count": 5,
    "report_digest": "sha256:dbbf20567cbb5d2f123224a52a3bc1b039599556447d010a5d84609048f85aee",
    "canonicality": "AUTHORING_REFERENCE_NOT_EMPIRICAL_FACT_OR_FIXED_PLOT"
  },
  "closure_contract": {
    "suite_id": "closure-suite://cal0/i7@1",
    "architecture_decision_count": 106,
    "cal0_model_selection_count": 66,
    "criterion_count": 9,
    "required_artifact_count": 9,
    "residual_group_count": 71,
    "residual_item_count": 305,
    "blocking_residual_count": 0,
    "change_entry_count": 10,
    "scene_projection_cell_count": 90,
    "report_digest": "sha256:d0200cdb56745cd7530bda8d9b8e5554ec985503a0b775e6b8bcdf79585a3bf4",
    "closure_status": "VALIDATED_BASELINE_WITH_BOUNDED_RESIDUALS"
  },
  "artifacts": [
    {
      "path": "README.md",
      "role": "documentation",
      "sha256": "sha256:dd3e67f6e86ee2eae553f9dadbe36b5bf0a36ef7a75d46e62bce340033d61b81"
    },
    {
      "path": "authoring/cal0-i6-authoring-checklists.json",
      "role": "bootstrap",
      "sha256": "sha256:a4481651cb412f3240c0004173f5fce7b1eeb8b175be7ab2a067a7ec0203317d"
    },
    {
      "path": "authoring/cal0-i6-notification-templates.json",
      "role": "bootstrap",
      "sha256": "sha256:431efa514acd21d8d9834028d2838afcbf21d12b668d04603d8fd93db157b6d5"
    },
    {
      "path": "authoring/cal0-i6-projection-contracts.json",
      "role": "bootstrap",
      "sha256": "sha256:e2bd1c449c0a83f550ee0ad44748190a58f62046d8b2ee327fb98fed793a6264"
    },
    {
      "path": "authoring/cal0-i7-character-sheet-checklist.json",
      "role": "bootstrap",
      "sha256": "sha256:30eebe39e440521a76aa66a668000f5767a1f4a26cfd216ebba095fa658a02fd"
    },
    {
      "path": "authoring/cal0-i7-scene-projection-matrix.json",
      "role": "bootstrap",
      "sha256": "sha256:50ad6b0c26cf48ebaf3f26c4f917d1b9d44cdb4d187dbfdf5e58fc6e7120c99a"
    },
    {
      "path": "canonical/litrpg-system-calibration-annex.md",
      "role": "documentation",
      "sha256": "sha256:fbaedea4bd3268303c10cff4e1b2ae4ba256da2c28516596208971a5a18c63cf"
    },
    {
      "path": "canonical/litrpg-system-specification.md",
      "role": "documentation",
      "sha256": "sha256:080e23cfa15d18d1ab443b346be62bb92f0af36d717e37d84b295028d9de5ee5"
    },
    {
      "path": "characters/cal0-i6-reference-sheets.json",
      "role": "bootstrap",
      "sha256": "sha256:4858574f8b8c516a4ee4a185c296775bf5eb8bc9ef60a4f43581d7012bcdbd1d"
    },
    {
      "path": "closure/cal0-i7-closure-review.json",
      "role": "fixture",
      "sha256": "sha256:b93ad200f2f860ab92c8edc470c601569bcf9b6ef38845a868302c69ef510844"
    },
    {
      "path": "fixtures/cal0-i1-fixtures.json",
      "role": "fixture",
      "sha256": "sha256:1dcc1e2f6c14dffeeabd4be99a44b00dcb3b12aeeb333e419123f7d2042ceeb0"
    },
    {
      "path": "fixtures/cal0-i2-fixtures.json",
      "role": "fixture",
      "sha256": "sha256:9d9fe5c107b61f07eb87b15da4c236d3571a514764e347e219c8fbcc3951a332"
    },
    {
      "path": "fixtures/cal0-i3-parameter-fixtures.json",
      "role": "fixture",
      "sha256": "sha256:d35c26faf323025faed9a3041cc708b3f13cfa532fa90c46e738b2d64de60f2c"
    },
    {
      "path": "fixtures/cal0-i4-fixtures.json",
      "role": "fixture",
      "sha256": "sha256:8c4fd29be992b781c9d1dd56918131922ea1bcceacecdb07976c268092547242"
    },
    {
      "path": "fixtures/cal0-i5-fixtures.json",
      "role": "fixture",
      "sha256": "sha256:ca47cb3ad4bc0534b4c949861ada144c616597f650744358c5fbdac828875f30"
    },
    {
      "path": "fixtures/cal0-i6-fixtures.json",
      "role": "fixture",
      "sha256": "sha256:46efb4368a0d25952fc7ad546b455bffe906cd53555fa861107e69dd997852d5"
    },
    {
      "path": "fixtures/cal0-i7-fixtures.json",
      "role": "fixture",
      "sha256": "sha256:43967ea825e081c26df9648969cb92c63d4f5d354e2433e9a21a2b3e14c6ccfa"
    },
    {
      "path": "guide/litrpg-system-authoring-templates.md",
      "role": "documentation",
      "sha256": "sha256:127388897a3473b34205e170a8a2de67213374c3348069973c522aefb86a48d0"
    },
    {
      "path": "guide/litrpg-system-reference-sheets.md",
      "role": "documentation",
      "sha256": "sha256:f8052e510becbae2df4d5a7ee4b54c92caf10b0c7937fb90ec1e203bf146c890"
    },
    {
      "path": "guide/litrpg-system-residual-uncertainty-register.md",
      "role": "documentation",
      "sha256": "sha256:565dd7cc3a0e5c1539019f4b4ac64c61d606871b888a9d9a0d3bcd09b6203c52"
    },
    {
      "path": "guide/litrpg-system-story-guide.md",
      "role": "documentation",
      "sha256": "sha256:5a98ccd5a814bbbeb66d87e3fc2fb753e1828906978130c655e3e04fdba34a7b"
    },
    {
      "path": "guide/litrpg-system-validated-closure.md",
      "role": "documentation",
      "sha256": "sha256:ffb2ed799dd17efc982d61a09a9d634d7f5aaa83e0031bd443107100f100dd50"
    },
    {
      "path": "guide/litrpg-system-worked-scenarios.md",
      "role": "documentation",
      "sha256": "sha256:00dc0cb8d94b43cb187ba175f8d8fbff336e1b3be622880bad48950443e5eccf"
    },
    {
      "path": "pyproject.toml",
      "role": "bootstrap",
      "sha256": "sha256:45277e8de49ff1bad1fa79956e5bdf3e76e9bc288ff385bc5d97c15f6302c94c"
    },
    {
      "path": "registries/cal0-i3-parameters.json",
      "role": "registry",
      "sha256": "sha256:88898d230a83a00a6907f08927265b4b216045dee314b67a031f32660d9a85c0"
    },
    {
      "path": "registries/cal0-i4-parameter-assessment.json",
      "role": "registry",
      "sha256": "sha256:205cdb643c9edb7aebbe6eed4357333700287c51040f277a08a099bea1e271ad"
    },
    {
      "path": "registries/cal0-i6-change-register.json",
      "role": "registry",
      "sha256": "sha256:b0a0905c2a758fd3d35c9ea0852ef27db3142f6102c5335238fbb321d8a4d79c"
    },
    {
      "path": "registries/cal0-i6-decision-resolution.json",
      "role": "registry",
      "sha256": "sha256:10b205e45f8dbadd95fa2d8a5c7bdfec249c146dfa1dcdc704fd8044be67749c"
    },
    {
      "path": "registries/cal0-i7-change-register.json",
      "role": "registry",
      "sha256": "sha256:d46e0ff86dd99945f7f8bd791dbb7afede37d7e137828b4a24472576742f01a8"
    },
    {
      "path": "registries/cal0-i7-residual-uncertainty.json",
      "role": "registry",
      "sha256": "sha256:10b892879027ef051dbc5f7248bb4b94b4a2338d97eb64977c168e9e7afcfe46"
    },
    {
      "path": "registries/canonical-primitives.json",
      "role": "registry",
      "sha256": "sha256:a0232564ff009065bb0a03091540f9d0cbcf380e3cb6ad7e345a8a763e11bd46"
    },
    {
      "path": "registries/model-families.json",
      "role": "registry",
      "sha256": "sha256:f31e846eb26ed3994be0a09b3d6f634eb3a6d3eda7182c1c58738f43439d8479"
    },
    {
      "path": "registries/parameter-record-types.json",
      "role": "registry",
      "sha256": "sha256:a433c8539bec8b89f058f7f713046895ba23d640fad4af81b1aee8b9e264d9b4"
    },
    {
      "path": "registries/schema-registry.json",
      "role": "registry",
      "sha256": "sha256:52ce36673b5c61bbd3452fff5add344367fcf456c9e7f5775efd1fb82820f62e"
    },
    {
      "path": "reports/cal0-i2-fixture-report.json",
      "role": "fixture",
      "sha256": "sha256:3889563d91d7945a1e4c6b5156132e11ff7986b42a52be80c0e7dbed2a86b8e3"
    },
    {
      "path": "reports/cal0-i3-reference-report.json",
      "role": "fixture",
      "sha256": "sha256:2f7f8c2edd72b1a0733e6f5d4ce601294eb67acab5522fda469ab06072dc22f5"
    },
    {
      "path": "reports/cal0-i4-cohort-report.json",
      "role": "fixture",
      "sha256": "sha256:e3b63f17119b1047e373811691f70fa52bef2da5eb58469565946e85983ab2af"
    },
    {